,id,title,score,stars,content
0,1291546,霸王别姬,5,5,真后悔第一次看这个片子是在大教室看，一百多个人，观影很不理想。这种片子应该在夜深人静时，一个人默默观赏的，只有这样，才能真正体会到这部电影的魅力。我是假霸王，你是真虞姬。
0,1291546,霸王别姬,2,7,又是一部经典被我打低分的电影 无法理解 过两年再看一次
0,1291546,霸王别姬,5,9,06年高考后我记不清的某个傍晚。两个小时的时间如在整个世纪般长短的慢镜之中。“说好了是一辈子，差一年，差一个月，差一个时辰，都不是一辈子！”模糊了爱与生存。社会乃至人生是不是从来都和我们想象的不一样？
0,1291546,霸王别姬,5,5,已经看过很久了  感觉看一次完全不能够彻底理解影片所想要表达的 跟同学一起看的  中间没去厕所也没玩手机  深深的记得          说好了一辈子，少一年、一天、一个时辰，都不是一辈子。  影片中的程蝶衣是真的虞姬  成就了自己  也成就了那个时代
0,1291546,霸王别姬,2,4,连导演自己都不能超越的大作，我却提不起劲来……有空啊你们仨
0,1291546,霸王别姬,5,10,属于很棒但我不敢看第二遍的片子。
0,1291546,霸王别姬,5,5,现在这个年纪再看，真真看出时代的无奈。虞姬死了，蝶衣死了，张国荣死了，陈凯歌某种程度上也死了，京剧，怕是离死也不远了。这些隐喻和眼神，这些情节把控与光影运用，什么时候才能在国产片里重现呢。
0,1291546,霸王别姬,5,63,震撼吗？震撼，当然震撼，不被震撼不是中国人！真有那么好吗？不知道，我真不知道，跟“震撼”划清界限！“你也不出来看看，这世上的戏都唱到哪一出了。”只怪最后的火，烧得太滚烫，照着你俩复出的冷光，也再不能冷下来。→2018高二下学期音乐课二刷。→2018.7.17集训三刷。
0,1291546,霸王别姬,3,4,三星不是评给剧本身 是我自己看的感受…说实话 片子对于我越到后面越感觉有些冗长了…耐不下心来跳着看完的……看的时候觉得：角色选的真好，孩子们演的真入木三分，尤其蝶衣最初送去戏班子时的形像；蒋雯丽短短出场但演的生动…越到后面时代大背景下的内斗叫人感到无限悲哀…
0,1291546,霸王别姬,4,1,小时候看的，被那种怪异的氛围吓到了，后来发现李碧华就是这种调调，好在拍得早，风情和情怀都在。
0,1291546,霸王别姬,5,10,已经不知道应该说什么的好电影了吧。
0,1291546,霸王别姬,3,7,"名過其實, 中國影視作品中最被高估過譽的一部, 被洋人們對東方文化的獵奇心理綁架的典型案例, 從衆心態下你要不說好都顯得自己不合羣"
0,1291546,霸王别姬,5,2,他還演著那場郎騎竹馬來的戲，他還穿著那件花影重迭的衣，他還陷在那段隔世經年的夢，靜靜合衣睡去，不理朝夕。他演盡了悲歡也無人相和的戲，那燭火未明搖曳滿地的冷清，他搖落了繁花空等誰記起，為夢送行的人，仍未散去。很可惜到目前為止，再也沒有上得了檯面的類似題材。
0,1291546,霸王别姬,5,16,几次性向的情节也和情感的确认相关，一开始总是拒绝念出我本是女娇娥，到最后一次说我本是男儿郎，是儿时两人大角梦起相互扶持的开端和梦碎后的清醒。程蝶衣的一生只为戏，从儿时逃走又返回戏班便知他只痴戏，经历强迫凌辱，到最后则是因梦醒心死。段小楼是个站在现实面反映时代下大多数人选择的角色，他可以唱戏也可以某其他生路，他唾弃为日本人演出的蝶衣，到后期却也屈服于浩大的声量而揭发蝶衣，更掐断了菊仙的痴情。菊仙是个刚毅的女子，面对戏班师父、袁四爷都展现出一番气势，最后输给了自己最爱的段小楼，因为心死了所以没有可以坚持和维护的东西了。整部电影跟着年代走，看到时代变迁下每个人的遭遇更觉个体的渺小和命运的未知流转。心里堵。
0,1291546,霸王别姬,4,1,“我本是男儿身，又不是女娇娥”就像他一生禁锢在这女娇娥中，连生存方式都由不得自己选，被老太监玷污后捡了小四，即是自己对命运的低头，再卑微也一样得活着，得成角儿。只可惜整部戏从细节到发展都太戏剧化了。最大的成功是张国荣这个非典型选角，是不是对顾长卫后来选择郭富城演农民也产生了影响呢
0,1291546,霸王别姬,5,27,打多少分都不够，整个中国都浓缩进了这一百多分钟。认知障碍人戏合一的虞姬，庸俗圆滑鲁莽负心的霸王；洒脱纯洁的妓女，深埋信仰的徒弟。人生在世，想活的好居然是不可能的事。
0,1291546,霸王别姬,4,4,这真的不是电影，而是人生。
0,1291546,霸王别姬,5,5,霸王只在戏里是霸王，虞姬在戏外仍是虞姬。虞姬对戏，不疯魔不成活，只求知己，无论身份。打着情感的牌子，相爱相杀，却又直指中国近代混乱无知。社会动荡，又何尝不似刘邦的四面楚歌?当蝶衣冒着大雨偷看小楼在和菊仙谈着家常，喝着小酒时，可能他终于明白了不是只有霸王和虞姬之间的爱才高于一切。
0,1291546,霸王别姬,5,7,历史变迁中的情爱终究如幻似梦，遍地花满楼的世道，哪有唱念做打的情境？累世公卿的袁世卿没了，但是投机两面的“那爷”永远都在。左也没错，右也没错，只是德先生侧重的两种形式。然而当左变成了极左，右变成了极右，我们就成了左支右绌段小楼。既保不住被张成蹂躏的师弟，也保不住备遭折磨心如死灰的菊仙。菊仙可真好啊~希望我们可以不被逼着揭发“姹紫嫣红，断壁残垣”，也不必被破题练功，逼着成给别人看的“角儿”，每个人做好自己人生的“角儿”就很好很幸福了。
0,1291546,霸王别姬,5,1,空前绝后的改编经典。两个真虞姬，一个假霸王。李碧华擅长写【奇情】，也注定了它并不会是一个简单的讲述人与人【情事】的故事。也许是只有国人才能真正看懂的悲剧。作为一个对楚地与项羽虞姬本就有着别样情结的人，深深被此作的镜头语言与各式隐喻打动了。如今，这世间的戏又唱到哪一出了呢？
0,1291546,霸王别姬,5,8,一部经典耗尽了陈凯歌所有的天赋，选对了张国荣演程蝶衣就已经成功了一大半了......
0,1291546,霸王别姬,5,1,致一个（可能的）伟大的中国电影时代的早夭，这片土地上遭受苦难的人民，在发出一声微弱的呻吟后又复归沉默，那个的确是最好的时代，而最终我们将重新进入一无所有、一无所知的混沌。
0,1291546,霸王别姬,4,4,人名来自于《报仇》，关小楼白袍染碧血，以死复仇；段小楼苟且偷生，霸王不在。电影讲的是戏子，拍的也是一部戏剧。尤其是拍到十年浩劫时，红旗招展，烈火焚天，已经彻底成为了两位角的个人秀。电影本身的三角恋很是无趣，但奈何有着“同性”，“反思”等诸多名牌可以遮掩，尚可以自圆其说。这种反思作品还是在告诉着我们每一次政治动荡，所掀起来的一定不只是高层的洪水，更是一把把割在每一个普通人身上的匕首，流出来的是鲜血，落到地上便成了泪水。
0,1291546,霸王别姬,5,1,“拍《霸王别姬》和《活着》的时候，我很是高兴，觉得我们终于起步了，可我没想到，那就是我们的终点。”
0,1291546,霸王别姬,5,1,文革最后互相揭发的镜头 让我想起了1984 或许那一段 才是整部电影最震撼我心的地方 人性最后毫无保留的暴露无遗 这是纯粹的 纯粹的恐怖片
0,1291546,霸王别姬,5,1,终于把这个老电影看完了。时间跨度如此强烈的影片总会让人感到沧海桑田。陈凯歌早期的作品还是不错的，可惜他的才华已经被商业利益逐渐侵蚀。
0,1291546,霸王别姬,4,1, 鸽子背景声音  喝酒场景 老北京腔 跳跃性的省略 婚变 戏子成角儿 菊仙精明 戏班的传统 突然地哭 和突然地死  丧礼的反差  血的夸张  虚实金鱼镜头 鸦片 长镜头传递头套 夸张 年老后的选择 刚毅的性格 后台场景 焚烧戏服 戏痴戏迷
0,1291546,霸王别姬,5,1,重看了霸王别姬，感触蛮多的，说的一对戏子和一个妓女的一生。然后感情纠葛及时代变迁伴随着他们这一生。对京剧也有初步的了解，只是可能不喜欢这种艺术，因为没亲眼的欣赏过。看了陈凯歌的梅兰芳，载体有点相似，看的也好看的。不过霸王别姬是他自己所超越不了的。张国荣、巩俐的表演出彩。
0,1291546,霸王别姬,5,4,张国荣演的太好了，凄美而感动。虞姬是真虞姬，霸王是假霸王。
0,1291546,霸王别姬,5,19,一个假霸王，两个真虞姬。真·时代的眼泪。大家都没错，只是生错了时代。唯一一部看完就想着什么时候再看一遍的电影。?
0,1291546,霸王别姬,5,2,太认真，你就输了。历史上孰是孰非谁又讲的清楚？你若用人性来考量爱情友情你又犯了大忌。改革到来的时候，不是螳臂能当得了车的，要顺应潮流，正所谓识时务者为俊杰。不过人也是要有些节气的。菊仙的为人处事还是蛮不错的，我想蝶衣也看得清楚。不能对这戏太认真，太认真就伤了，真真是“难得糊涂”。
0,1291546,霸王别姬,5,4,如果拍完这部电影就死去，陈凯歌就不朽了！！可惜他后来又拍了不少电影
0,1291546,霸王别姬,5,5,电影里时代的洪流啊，人性啊，感情啊好得我无话可说，但是部分评论里坚持程蝶衣是男变女，恐同又对跨性别想当然的样子真的很好笑
0,1291546,霸王别姬,5,1,美丽的re再次心有所属 哎哟 我爱她女人。和天表一起看到凌晨四点多 | 2018.9.17重温，这么多年过去自然懂了很多。这部戏说的是颠倒，身份的颠倒，性别的颠倒，时代的颠倒，在那个黑亦是白白亦是黑的时候，悲剧无处不在。程蝶衣和菊仙虽性情不同，却都是有情有义之人，却不知为何有情有义却是所托非人。不疯魔，不成活。
0,1291546,霸王别姬,5,2,戏子入画，一生天涯。一个假霸王，一个真虞姬，一个深知人戏相别，一个不明人戏之分，最终竟成一谱哀歌。片是极好，只是不少人却只觉得张国荣乃此片灵魂，我却觉得张丰毅才是本剧灵魂，旧社会人民被岁月磨光棱角，最终浑浑噩噩的悲歌。
0,1291546,霸王别姬,5,8,華語影壇最好的電影，人要自己成就自己。不瘋魔不成活，人戲合一，風華絕代。Leslie，愿你已放下，常駐光明中。“人，得自個兒成全自個兒。”
0,1291546,霸王别姬,5,8,好久之前看得，中国电影史上不可错过的经典
0,1291546,霸王别姬,5,10,张国荣这……气场啊……我……一口血……
0,1291546,霸王别姬,5,7,哥哥的演技  一个眼神  一句话  都让人难以忘怀  程蝶衣演活了虞姬  都说人生如戏  戏如人生  他把人生活成了戏  他用自己的生命印证了“从一而终“一辈子”” 虞姬是针虞姬  霸王是假霸王  三个人都是悲剧 或许“人生下来就注定了什么样的结局” 是斗不过天的
0,1291546,霸王别姬,5,1,一曲京戏，带我们走过了中国近半个世纪。虞姬依旧在唱，而其他人与台下的观众一直在变，连日本兵都护着的京戏最后却栽在了自己人的手上，这是属于时代的悲哀。往事不要再提，人生已多风雨。
0,1291546,霸王别姬,5,8,后面有点凌乱。编剧大赞
0,1291546,霸王别姬,5,14,"他说，虞姬是真虞姬，霸王是假霸王。在听说张国荣自杀的消息后,陈凯歌痛哭失声，说：“他真的成了程蝶衣了。”当世之中除了张国荣，根本没有人能替代演出程蝶衣的角色。人戏不分，雌雄同在，既是程蝶衣的人生写照，也是程蝶衣与张国荣的镜像关系。或许张国荣一生都没有出戏。他本身就是一个传奇。"
0,1291546,霸王别姬,5,76,我也揭发！揭发姹紫嫣红！揭发断壁残垣！
0,1291546,霸王别姬,1,14,以文革为背景讲基佬的故事，外国人喜欢看就吹起来了
0,1291546,霸王别姬,5,4,重看真的太喜欢前半段了，小时候看不懂，现在看到结婚已经心碎成渣。小演员们的表演很棒，张国荣就不用说了，出神入化。最喜欢的是蝶衣和菊仙之间的关系，特别是最后，从一而终同一个人却演出不一样的悲剧；是相互嫉妒却也是最惺惺相惜不过。小楼就不说了，这个角色太现实，污秽。
0,1291546,霸王别姬,2,8,陈凯歌，你不用拍电影了，恶心不死我，吐，电影看后每次听 张国荣  唱歌  都想哭
0,1291546,霸王别姬,5,3,看过很多遍，最近又重看，不知为何，上了年纪看，更加感动。斯坦尼康拍出长镜头中的蒋雯丽很是年轻，似乎那个时代——90年代中国电影黄金期，都以远去。
0,1291546,霸王别姬,5,5,看了张国荣给香港中文大学的讲座笔记，谈到几点，1.结局是他和张丰毅俩人商量的结果，2.张丰毅和陈凯歌是恐同者，抱住Leslie的时候张丰毅人都在发抖。对张丰毅和陈凯歌只能呵呵，这片能得奖都知道是谁的功劳
0,1291546,霸王别姬,5,6,黄药师大战天山童姥
0,1291546,霸王别姬,5,8,上次完整看还是十年前，重看才知道好多地方当年是真没看懂，看懂了要哭死……
0,1291546,霸王别姬,1,17,梨园行虐待小孩还顺理成章的，这就是所谓的传统文化。
0,1291546,霸王别姬,4,3,風扇裡藏著失眠的魔咒 入夢究竟要轉夠幾億光年才夠。失眠的深夜翻出這部舊電影來看 看完時 窗外的天空也已經矇矇亮了。其實很早就看過了 但和大多數人不同的是 這部電影並沒有給我帶來太大的體悟。直到今天 被柔弱的程蝶衣所觸動。還記得他初成角兒 在戲院門前的那一回眸 讓我誤以為是宋丹平回來了。
0,1291546,霸王别姬,5,3,人生如戏，辨不清实虚。你用一杆烟夺了我的心，从此我便是女娇娥，而不是男儿身，挡不住世事缱绻风云恩怨，纵使霸王不在，虞姬依旧。二十三年再聚首，看穿与否都用剑刎换来世，缘再续。国片第一。
0,1291546,霸王别姬,5,6,中国两岸三地成就最高，最富有艺术感染力的电影！张国荣的媚气，张丰毅的霸气，巩俐的俗气，全部入木三分！
0,1291546,霸王别姬,5,6,我还是闭嘴吧，没法评的片儿，怎么不让打十星。
0,1291546,霸王别姬,5,1,时代变迁，不同的领导者，不一样的看戏，你活在戏里，却无法摆脱现实的摧残，他活在戏外，依然受到里现实无情的批判，电影用它那有力的讽刺告诉我们：戏里戏外，都是人生。一个民族的是否真正存在，在于它对文化的态度。
0,1291546,霸王别姬,5,0,如果一部电影很厉害，那不同的人生阶段看，会有不同的体会。《大话西游》是这样的电影，《霸王别姬》也是。小时候觉得《大话西游》怎么会看不懂，不就是很好笑？后来再看，发现更好哭。小时候哪里看得懂《霸王别姬》，不够有趣，故事又悲苦混乱，根本看不下去。后来再看，写下的影评居然是因为“文化大革命”那段戏让我高潮了。可能是第一次通过影像了解那段奇怪历史。现在再看，“大部分”奇怪和悲苦都明白了，甚至能捕捉到一些有趣。这就是人生啊，哪有不苦的。但容下苦，方知甜珍贵。
0,1291546,霸王别姬,5,6,小时候看，不懂，嫌弃四爷，现在看，才知道四爷真是蝶衣的知己。
0,1291546,霸王别姬,5,5,人得自个儿成全自个儿。就让我跟你好好唱一辈子戏， 一辈子，就是一辈子，差一年，一个月，一天，一个时辰， 都不算一辈子
0,1291546,霸王别姬,5,3,好吧，此前我认为《鬼子来了》是最好的中国电影，看了《霸王别姬》，《鬼子来了》需要加个后缀名——之一。张国荣啊！！！不疯魔不成活！！！……“差一年一个月一天一个时辰，都不是一辈子！！” 这话听得我心都碎了。
0,1291546,霸王别姬,4,4,风华绝代的哥哥~不疯魔不成话的执迷～陈凯歌最好的电影～
0,1291546,霸王别姬,4,2,一部好电影需要融入多种元素，且所有元素都自然而然又相互作用增效于电影。文化历史情爱是本片最鲜明的标签且相互缠绕，个中滋味在171分钟内让人大呼过瘾。张国荣在这部电影已经得道成仙了，巩俐英达葛优的表演也十分入骨，只有段小楼和张丰毅戏里戏外的俩人我都打算鄙视一辈子。
0,1291546,霸王别姬,5,7,张国荣竟然没有因此片得到任何一个有分量的奖项。
0,1291546,霸王别姬,5,3,一出霸王别姬唱过了整个中国近代史，在最后的最后，虞姬自拔剑，曲终人亦散。 不管是舞台上的万众瞩目，还是权力中的呼风唤雨，每个人在永恒的时间长河里都只是一个小人物，愿望不过是想安安稳稳地唱好人生这一出戏，却总是不由自主地被巨大的历史洪流卷裹着，被踏入尘埃或被推搡着前进，身不由己。
0,1291546,霸王别姬,5,1,最极致的感情，最懦弱的内心，最纯粹和最平庸怎能在一起。楚霸王保护不了虞姬，不论是谁，他的懦弱成为一把利剑，刺伤周围爱他的人。我本将心向明月，奈何明月照沟渠。也罢，没有霸王的虞姬在骨子里强大起来，我本是男儿郎，又不是女娇娥。我自刀枪不入，我自百毒不侵。只是，哀莫大于心死罢。
0,1291546,霸王别姬,4,2,看的后来我被气哭了无论是旧社会还是新社会普通的百姓永远逃不过残酷社会的扼杀我本是女儿身却得做男儿郎
0,1291546,霸王别姬,5,25,豆瓣应该自信一点，排个第一得了
0,1291546,霸王别姬,5,3,昨晚又看了一次，到，一点钟。忽然想，可能，张国荣的一辈子，也就在这一部戏里，演完了吧。
0,1291546,霸王别姬,5,1,戏如人生，人生如戏，戏里戏外，真真假假，多少欢喜，多少忧愁，涕落千杯醉，人愁泪满衫，如果回到过去，最终的结果也还是如此……
0,1291546,霸王别姬,5,1,中国电影的巅峰之作。巅峰过后，凯歌开始走下坡路，哥哥已离开人世。就像戏如人生，人生如梦。
0,1291546,霸王别姬,4,0,看完了才知道，演的不只是一部戏。最后，一句话戳中泪点。谁不是呢？每个人都有自己的命。人得自个成全自个
0,1291546,霸王别姬,4,3,无疯魔，不成活。就算这片子里所有演员都可以替换，张国荣也是唯一那个无法换掉的。。。
0,1291546,霸王别姬,5,1,不行！说的是一辈子，差一年，一个月，一天，一个时辰，都不算一辈子！
0,1291546,霸王别姬,5,1,特殊年代的特殊情感  救赎  背叛 无耐而痛苦的人生  人性的摧残，让人心痛！
0,1291546,霸王别姬,5,8,舞台上下，帝王将相，性别模糊，纠葛的感情，互相珍惜互相伤害，写一段绝唱，令人扼腕。
0,1291546,霸王别姬,2,4,因为逝者已矣所以什么片子都要膜拜么？反反复复历时4年把它看过了不下5遍，因为不想支持派批判我肤浅地惘置评论，但是对于这部电影真的没什么好评，看不到这么多人煞有介事的动机。
0,1291546,霸王别姬,5,0,kd觀影冥王星/天蝎/8宮，“人得自個兒成全自個兒”  台詞好演技好，個人在時代洪流的衝擊、社會勢力人物更替中的命運 kd:程蝶衣是為理想而活的，但凡他進到9宮10宮（在被替換下來後）拔高到非遺，停留在8宮（8有它的路徑依賴，有捨有得），段和菊仙都已經認識到時代已經變了變天了不能捨棄兵（師兄弟 整個戲班的人）  小四不是純粹的壞人，關師父對他小時候的評價“怕他狂”，是一心想當角的為當角  為什麼要把段單獨摘出來審問恐嚇，給他水泥磚不是紅磚，/冥王星在長在小四心理，自我否定（看到他師父吸大煙，他為什麼要否定他的師傅和師娘，因為他錯誤的認為了只要固定他的師傅和妓女師娘他就是乾乾淨淨的，因為他是個沒有爸媽的孩子，所以他要去切割。）/段揭發那段，是為了保全所有人，不是假霸王，從小保護弱者，有自己的道
0,1291546,霸王别姬,5,1,风华绝代 中国电影与中国文化淋漓尽致的糅合一体 真正的好电影
0,1291546,霸王别姬,5,3,我没在这电影里看到什么同性恋，只是一个戏痴，一个理想的追梦人的几十年人生。感觉现在的人越来越浮躁，流于表面了。只看到画面却不能看到其中的深意，人物的内心。就像喝茶，有的人小口品茗，有的人大碗解渴，而后者越来越多了。程蝶衣是真虞姬，段小楼是假霸王。对于程蝶衣来说，也许自己的艺术理想，自己的京戏，才是真正的霸王。但剧中有另一个角色，就是菊仙。菊仙理解程蝶衣。菊仙只想平平安安，安安稳稳地过一生，程蝶衣是虞姬的柔而菊仙是虞姬的刚。两个真虞姬却喜欢上了假霸王。不知是可笑还是可悲。而段小楼，对于生活的压迫，生存的压力下，已经不是曾经的霸王了。这部电影呢，我不想用五星来拘泥于他。但这个真的是一部只有中国人才能看得懂的电影。
0,1291546,霸王别姬,4,2,当初看的时候并不懂，不懂蝶衣的执着，不懂段小楼的懦弱、，不懂菊仙的善良和坚强~现在呢？都懂了，却也都看透了~
0,1291546,霸王别姬,5,2,4月10日，衡山电影院，霸王别姬终于登上了大荧幕。四处都是文艺青年或者二逼青年，那时的葛优未被后来的喜感颠覆，那时的张丰毅早已有老戏骨的雏形，那时的张国荣正风华绝代。感谢中国最伟大的导演奉献给这个世界的永恒回忆，陈凯歌，只需用一部电影来这证明自己的伟大。
0,1291546,霸王别姬,5,1,段小楼（张丰毅）与程蝶衣（张国荣）是一对打小一起长大的师兄弟，两人一个演生，一个饰旦，一向配合天衣无缝，尤其一出《霸王别姬》，更是誉满京城，为此，两人约定合演一辈子《霸王别姬》。但两人对戏剧与人生关系的理解有本质不同，段小楼深知戏非人生，程蝶衣则是人戏不分。　　段小楼在认为该成家立业之时迎娶了名妓菊仙（巩俐），致使程蝶衣认定菊仙是可耻的第三者，使段小楼做了叛徒，自此，三人围绕一出《霸王别姬》生出的爱恨情仇战开始随着时代风云的变迁不断升级，终酿成悲剧。
0,1291546,霸王别姬,5,3,今晚研究生会的观影又看了一遍，人性的冷漠、时代的轮换、个人的无力，最大的感触是个体名誉面对时代宏潮之时的无可奈何，时代发展太快，让我们如何坚守我们该坚守的；岁月轮转不停，让我们怎样信念我们该信念的？是与时俱进，还是坚守自我？这些都是值得思考的问题，尤其是在这个技术日新月异，变革不
0,1291546,霸王别姬,5,1,跨越整个时代的故事总是能带来很多震撼，影片中的很多台词都耐人寻味。“一个人有一个人的命”，“这就是你的命”，命运的坎坷曲折不是三言两语就能概括的。小石头认为“那是戏”，在小豆子看来戏如人生，不疯魔不成活，假霸王与真虞姬，或许袁四爷才算得上霸王。
0,1291546,霸王别姬,5,1,我曾经的QQ签名是，悲哀的原因是，有话说不出来，曾经是一个悲哀的时代，曾经人们的嘴只有吃饭时才是自己的。
0,1291546,霸王别姬,5,4,二刷。“不疯魔不成活”是程蝶衣，审时度势是段小楼；一直在戏里是程蝶衣，戏里戏外切换自如是段小楼；京戏高于一切是程蝶衣，任何一切都可以高于京戏是段小楼。虽然是两种艺术态度，但却殊途同归，终究敌不过时代的巨轮；虽不是高山流水知音，但却互相牵绊一生。
0,1291546,霸王别姬,5,2,小石头和小豆子要一辈子在一起演戏。一辈子，差一年、一个月、一天、一个时辰也不是一辈子。哥哥真的好美，好美。
0,1291546,霸王别姬,[NULL],4,说好了一辈子，少一年、一天、一个时辰，都不是一辈子。
0,1291546,霸王别姬,5,0,2012-161.十万春花如梦里——再看《霸王别姬》
0,1291546,霸王别姬,5,0,程蝶衣，段小楼，孰是孰非，这里没有可以定论的，只是一个为了生计为了活不断的改变着，没有底线，而另一个，无论社会，环境怎么变，始终活在戏里从未放弃过对最初的东西的执着，从清末到文革，始终如此。程蝶衣活在了一个错的时代，但他也只能适合在这个时代，他投错了胎但也只能是男儿郎才能如此惊艳
0,1291546,霸王别姬,4,9,几句话我说不清它。
0,1291546,霸王别姬,1,11,混乱的意识形态，苍白的叙事手法，彩色的胶卷垃圾。
